{
  "profile": "ja-L1-child",
  "note": "Seed alignment records are citation-level summaries and codes. Full official standard text is not included in this seed.",
  "codesOnlySources": [
    "mext-es-ja-2017",
    "jp-cos-lod",
    "mext-kanji-grade",
    "bunka-joyo-kanji-2010"
  ],
  "curriculumCount": 6,
  "curricula": [
    {
      "slug": "mext-es-ja-2017",
      "country": "JP",
      "name": "Elementary School Course of Study: Japanese Language",
      "version": "2017 notification",
      "sourceUrl": "https://www.mext.go.jp/a_menu/shotou/new-cs/1387014.htm",
      "textIncluded": false,
      "license": "MEXT website terms / Government Standard Terms of Use 2.0; seed uses citation-level metadata only.",
      "topicCount": 12,
      "topics": [
        {
          "key": "mext-es-ja-2017:G1-2.knowledge",
          "code": "G1-2.knowledge",
          "data": {
            "label": "Knowledge and skills, grades 1-2",
            "note": "Citation-level alignment for early writing-system, vocabulary, and language knowledge."
          }
        },
        {
          "key": "mext-es-ja-2017:G1-2.speaking-listening",
          "code": "G1-2.speaking-listening",
          "data": {
            "label": "Speaking and listening, grades 1-2",
            "note": "Citation-level alignment for early oral interaction and listening."
          }
        },
        {
          "key": "mext-es-ja-2017:G1-2.writing",
          "code": "G1-2.writing",
          "data": {
            "label": "Writing, grades 1-2",
            "note": "Citation-level alignment for early sentence and experience writing."
          }
        },
        {
          "key": "mext-es-ja-2017:G1-2.reading",
          "code": "G1-2.reading",
          "data": {
            "label": "Reading, grades 1-2",
            "note": "Citation-level alignment for early story and poem reading."
          }
        },
        {
          "key": "mext-es-ja-2017:G3-4.knowledge",
          "code": "G3-4.knowledge",
          "data": {
            "label": "Knowledge and skills, grades 3-4",
            "note": "Citation-level alignment for vocabulary, kanji, grammar awareness, and dictionary use."
          }
        },
        {
          "key": "mext-es-ja-2017:G3-4.speaking-listening",
          "code": "G3-4.speaking-listening",
          "data": {
            "label": "Speaking and listening, grades 3-4",
            "note": "Citation-level alignment for questions, discussion, and short presentations."
          }
        },
        {
          "key": "mext-es-ja-2017:G3-4.writing",
          "code": "G3-4.writing",
          "data": {
            "label": "Writing, grades 3-4",
            "note": "Citation-level alignment for paragraph, report, and opinion writing."
          }
        },
        {
          "key": "mext-es-ja-2017:G3-4.reading",
          "code": "G3-4.reading",
          "data": {
            "label": "Reading, grades 3-4",
            "note": "Citation-level alignment for informational reading, literary reading, and text features."
          }
        },
        {
          "key": "mext-es-ja-2017:G5-6.knowledge",
          "code": "G5-6.knowledge",
          "data": {
            "label": "Knowledge and skills, grades 5-6",
            "note": "Citation-level alignment for advanced vocabulary, language variation, and language awareness."
          }
        },
        {
          "key": "mext-es-ja-2017:G5-6.speaking-listening",
          "code": "G5-6.speaking-listening",
          "data": {
            "label": "Speaking and listening, grades 5-6",
            "note": "Citation-level alignment for structured discussion and presentation."
          }
        },
        {
          "key": "mext-es-ja-2017:G5-6.writing",
          "code": "G5-6.writing",
          "data": {
            "label": "Writing, grades 5-6",
            "note": "Citation-level alignment for purpose, audience, organization, and revision."
          }
        },
        {
          "key": "mext-es-ja-2017:G5-6.reading",
          "code": "G5-6.reading",
          "data": {
            "label": "Reading, grades 5-6",
            "note": "Citation-level alignment for comparing texts and monitoring interpretation."
          }
        }
      ]
    },
    {
      "slug": "mext-ls-ja-2017",
      "country": "JP",
      "name": "Lower Secondary School Course of Study: Japanese Language",
      "version": "2017 notification",
      "sourceUrl": "https://www.mext.go.jp/a_menu/shotou/new-cs/1387016.htm",
      "textIncluded": false,
      "license": "MEXT website terms / Government Standard Terms of Use 2.0; seed uses citation-level metadata only.",
      "topicCount": 11,
      "topics": [
        {
          "key": "mext-ls-ja-2017:G7.knowledge",
          "code": "G7.knowledge",
          "data": {
            "label": "Lower secondary Japanese knowledge and skills, grade 7",
            "note": "Citation-level alignment for first-year lower-secondary language knowledge."
          }
        },
        {
          "key": "mext-ls-ja-2017:G7.reading",
          "code": "G7.reading",
          "data": {
            "label": "Lower secondary Japanese reading, grade 7",
            "note": "Citation-level alignment for first-year lower-secondary reading."
          }
        },
        {
          "key": "mext-ls-ja-2017:G7.writing",
          "code": "G7.writing",
          "data": {
            "label": "Lower secondary Japanese writing, grade 7",
            "note": "Citation-level alignment for first-year lower-secondary writing."
          }
        },
        {
          "key": "mext-ls-ja-2017:G8.knowledge",
          "code": "G8.knowledge",
          "data": {
            "label": "Lower secondary Japanese knowledge and skills, grade 8",
            "note": "Citation-level alignment for second-year lower-secondary language knowledge."
          }
        },
        {
          "key": "mext-ls-ja-2017:G8.reading",
          "code": "G8.reading",
          "data": {
            "label": "Lower secondary Japanese reading, grade 8",
            "note": "Citation-level alignment for second-year lower-secondary reading."
          }
        },
        {
          "key": "mext-ls-ja-2017:G8.speaking-listening",
          "code": "G8.speaking-listening",
          "data": {
            "label": "Lower secondary Japanese speaking and listening, grade 8",
            "note": "Citation-level alignment for second-year lower-secondary discussion and presentation."
          }
        },
        {
          "key": "mext-ls-ja-2017:G9.knowledge",
          "code": "G9.knowledge",
          "data": {
            "label": "Lower secondary Japanese knowledge and skills, grade 9",
            "note": "Citation-level alignment for third-year lower-secondary language knowledge."
          }
        },
        {
          "key": "mext-ls-ja-2017:G9.reading",
          "code": "G9.reading",
          "data": {
            "label": "Lower secondary Japanese reading, grade 9",
            "note": "Citation-level alignment for third-year lower-secondary reading and classical-language foundations."
          }
        },
        {
          "key": "mext-ls-ja-2017:G9.writing",
          "code": "G9.writing",
          "data": {
            "label": "Lower secondary Japanese writing, grade 9",
            "note": "Citation-level alignment for third-year lower-secondary argument and composition."
          }
        },
        {
          "key": "mext-ls-ja-2017:G7.speaking-listening",
          "code": "G7.speaking-listening",
          "data": {
            "label": "Lower secondary Japanese speaking and listening, grade 7",
            "note": "Citation-level alignment for first-year lower-secondary listening, discussion, and oral expression."
          }
        },
        {
          "key": "mext-ls-ja-2017:G9.speaking-listening",
          "code": "G9.speaking-listening",
          "data": {
            "label": "Lower secondary Japanese speaking and listening, grade 9",
            "note": "Citation-level alignment for third-year lower-secondary listening, discussion, argument, and presentation."
          }
        }
      ]
    },
    {
      "slug": "mext-hs-ja-2018",
      "country": "JP",
      "name": "High School Course of Study: Japanese Language",
      "version": "2018 notification",
      "sourceUrl": "https://www.mext.go.jp/a_menu/shotou/new-cs/1407074.htm",
      "textIncluded": false,
      "license": "MEXT website terms / Government Standard Terms of Use 2.0; seed uses citation-level metadata only.",
      "topicCount": 9,
      "topics": [
        {
          "key": "mext-hs-ja-2018:G10.contemporary-japanese",
          "code": "G10.contemporary-japanese",
          "data": {
            "label": "High school contemporary Japanese, grade 10",
            "note": "Citation-level alignment for high-school contemporary Japanese foundations."
          }
        },
        {
          "key": "mext-hs-ja-2018:G10.language-culture",
          "code": "G10.language-culture",
          "data": {
            "label": "High school language culture, grade 10",
            "note": "Citation-level alignment for language culture foundations."
          }
        },
        {
          "key": "mext-hs-ja-2018:G10.inquiry",
          "code": "G10.inquiry",
          "data": {
            "label": "High school inquiry and information use, grade 10",
            "note": "Citation-level alignment for inquiry reading/writing and information use."
          }
        },
        {
          "key": "mext-hs-ja-2018:G11.logical-japanese",
          "code": "G11.logical-japanese",
          "data": {
            "label": "High school logical Japanese, grade 11",
            "note": "Citation-level alignment for argument, logic, and academic prose."
          }
        },
        {
          "key": "mext-hs-ja-2018:G11.literary-japanese",
          "code": "G11.literary-japanese",